<AjoutRequest xmlns="http://www.univ-tlse3.fr/Services/Covoiturage"
	xmlns:xsi="http://www.w3.org/2001/XMLSchema-instance"
	xsi:schemaLocation="http://www.univ-tlse3.fr/Services/Covoiturage Covoiturage.xsd">


	<Persone>
		<nom>toto</nom>
		<prenom>dupont</prenom>
		<email>existepas.alafac@univ-tlse3.fr</email>
	</Persone>
	 <Adresse>
		<numrue>1</numrue>
		<numpostal>31500</numpostal>
		<ville>toulouse</ville>
		<rue>Gaillac</rue>
	</Adresse>
	
</AjoutRequest>